{
  "resourceType" : "Condition",
  "id" : "PFEIG-Condition-UndressingConcern",
  "meta" : {
    "profile" : ["http://hl7.org/fhir/us/pacio-pfe/StructureDefinition/pfe-condition-problems-health-concerns"]
  },
  "text" : {
    "status" : "generated",
    "div" : "<div xmlns=\"http://www.w3.org/1999/xhtml\"><p class=\"res-header-id\"><b>Generated Narrative: Condition PFEIG-Condition-UndressingConcern</b></p><a name=\"PFEIG-Condition-UndressingConcern\"> </a><a name=\"hcPFEIG-Condition-UndressingConcern\"> </a><a name=\"PFEIG-Condition-UndressingConcern-en-US\"> </a><p><b>clinicalStatus</b>: <span title=\"Codes:{http://terminology.hl7.org/CodeSystem/condition-clinical active}\">Active</span></p><p><b>verificationStatus</b>: <span title=\"Codes:{http://terminology.hl7.org/CodeSystem/condition-ver-status confirmed}\">Confirmed</span></p><p><b>category</b>: <span title=\"Codes:{http://hl7.org/fhir/us/core/CodeSystem/condition-category health-concern}\">Health Concern</span>, <span title=\"Codes:{http://hl7.org/fhir/us/core/CodeSystem/us-core-category functional-status}\">Functional Status</span></p><p><b>code</b>: <span title=\"Codes:{http://snomed.info/sct 284989005}\">Difficulty undressing (finding)</span></p><p><b>subject</b>: <a href=\"Patient-PFEIG-patientBSJ1.html\">Betsy Smith-Johnson Female, DoB Unknown ( http://example.org/identifiers/patient#10A3D58WH1600)</a></p><p><b>recordedDate</b>: 2024-01-18 14:10:00-0500</p><p><b>asserter</b>: <a href=\"Practitioner-PFEIG-Practitioner-JenCadbury.html\">Practitioner Jen Cadbury</a></p><p><b>note</b>: Betsy is frustrated, embarrassed, and worried about not being able to undress herself</p></div>"
  },
  "clinicalStatus" : {
    "coding" : [{
      "system" : "http://terminology.hl7.org/CodeSystem/condition-clinical",
      "code" : "active"
    }]
  },
  "verificationStatus" : {
    "coding" : [{
      "system" : "http://terminology.hl7.org/CodeSystem/condition-ver-status",
      "code" : "confirmed"
    }]
  },
  "category" : [{
    "coding" : [{
      "system" : "http://hl7.org/fhir/us/core/CodeSystem/condition-category",
      "code" : "health-concern",
      "display" : "Health Concern"
    }]
  },
  {
    "coding" : [{
      "system" : "http://hl7.org/fhir/us/core/CodeSystem/us-core-category",
      "code" : "functional-status",
      "display" : "Functional Status"
    }]
  }],
  "code" : {
    "coding" : [{
      "system" : "http://snomed.info/sct",
      "code" : "284989005",
      "display" : "Difficulty undressing (finding)"
    }]
  },
  "subject" : {
    "reference" : "Patient/PFEIG-patientBSJ1"
  },
  "recordedDate" : "2024-01-18T14:10:00-05:00",
  "asserter" : {
    "reference" : "Practitioner/PFEIG-Practitioner-JenCadbury"
  },
  "note" : [{
    "text" : "Betsy is frustrated, embarrassed, and worried about not being able to undress herself"
  }]
}