{
  "resourceType" : "Condition",
  "id" : "PFEIG-Condition-AnemiaDiagnosis",
  "meta" : {
    "profile" : ["http://hl7.org/fhir/us/pacio-pfe/StructureDefinition/pfe-condition-encounter-diagnosis"]
  },
  "text" : {
    "status" : "generated",
    "div" : "<div xmlns=\"http://www.w3.org/1999/xhtml\"><p class=\"res-header-id\"><b>Generated Narrative: Condition PFEIG-Condition-AnemiaDiagnosis</b></p><a name=\"PFEIG-Condition-AnemiaDiagnosis\"> </a><a name=\"hcPFEIG-Condition-AnemiaDiagnosis\"> </a><a name=\"PFEIG-Condition-AnemiaDiagnosis-en-US\"> </a><p><b>clinicalStatus</b>: <span title=\"Codes:{http://terminology.hl7.org/CodeSystem/condition-clinical active}\">Active</span></p><p><b>verificationStatus</b>: <span title=\"Codes:{http://terminology.hl7.org/CodeSystem/condition-ver-status confirmed}\">Confirmed</span></p><p><b>category</b>: <span title=\"Codes:{http://terminology.hl7.org/CodeSystem/condition-category encounter-diagnosis}\">Encounter Diagnosis</span></p><p><b>code</b>: <span title=\"Codes:{http://snomed.info/sct 691421000119108}\">Anemia co-occurrent and due to chronic kidney disease stage 3 (disorder)</span></p><p><b>bodySite</b>: <span title=\"Codes:{http://snomed.info/sct 113257007}\">Structure of cardiovascular system</span></p><p><b>subject</b>: <a href=\"Patient-PFEIG-patientBSJ1.html\">Betsy Smith-Johnson Female, DoB Unknown ( http://example.org/identifiers/patient#10A3D58WH1600)</a></p><p><b>recordedDate</b>: 2024-06-23 13:15:00-0400</p><p><b>note</b>: See lab</p></div>"
  },
  "extension" : [{
    "url" : "http://hl7.org/fhir/StructureDefinition/condition-assertedDate",
    "valueDateTime" : "2024-06-23T13:15:00-04:00"
  }],
  "clinicalStatus" : {
    "coding" : [{
      "system" : "http://terminology.hl7.org/CodeSystem/condition-clinical",
      "code" : "active"
    }]
  },
  "verificationStatus" : {
    "coding" : [{
      "system" : "http://terminology.hl7.org/CodeSystem/condition-ver-status",
      "code" : "confirmed"
    }]
  },
  "category" : [{
    "coding" : [{
      "system" : "http://terminology.hl7.org/CodeSystem/condition-category",
      "code" : "encounter-diagnosis",
      "display" : "Encounter Diagnosis"
    }]
  }],
  "code" : {
    "coding" : [{
      "system" : "http://snomed.info/sct",
      "code" : "691421000119108",
      "display" : "Anemia co-occurrent and due to chronic kidney disease stage 3 (disorder)"
    }]
  },
  "bodySite" : [{
    "coding" : [{
      "system" : "http://snomed.info/sct",
      "code" : "113257007",
      "display" : "Structure of cardiovascular system"
    }]
  }],
  "subject" : {
    "reference" : "Patient/PFEIG-patientBSJ1"
  },
  "recordedDate" : "2024-06-23T13:15:00-04:00",
  "note" : [{
    "text" : "See lab"
  }]
}