{
  "resourceType": "Condition",
  "id": "betsysmith-johnson01-Condition-NauseaAndVomiting-01",
  "meta": {
    "profile": [
      "http://hl7.org/fhir/us/pacio-pfe/StructureDefinition/pfe-condition-encounter-diagnosis"
    ]
  },
  "text": {
    "status": "extensions",
    "div": "<div xmlns=\"http://www.w3.org/1999/xhtml\"><p class=\"res-header-id\"><b>Generated Narrative: Condition betsysmith-johnson01-Condition-NauseaAndVomiting-01</b></p><a name=\"betsysmith-johnson01-Condition-NauseaAndVomiting-01\"> </a><a name=\"hcbetsysmith-johnson01-Condition-NauseaAndVomiting-01\"> </a><div style=\"display: inline-block; background-color: #d9e0e7; padding: 6px; margin: 4px; border: 1px solid #8da1b4; border-radius: 5px; line-height: 60%\"><p style=\"margin-bottom: 0px\"/><p style=\"margin-bottom: 0px\">Profile: <a href=\"http://hl7.org/fhir/us/pacio-pfe/STU2/StructureDefinition-pfe-condition-encounter-diagnosis.html\">Personal Functioning and Engagement Condition Encounter Diagnosis Profile</a></p></div><p><b>Condition Asserted Date</b>: 2024-08-22 16:30:00-0400</p><p><b>clinicalStatus</b>: <span title=\"Codes:{http://terminology.hl7.org/CodeSystem/condition-clinical active}\">Active</span></p><p><b>verificationStatus</b>: <span title=\"Codes:{http://terminology.hl7.org/CodeSystem/condition-ver-status confirmed}\">Confirmed</span></p><p><b>category</b>: <span title=\"Codes:{http://hl7.org/fhir/sid/icf b5350}\">Sensation of nausea</span>, <span title=\"Codes:{http://terminology.hl7.org/CodeSystem/condition-category encounter-diagnosis}\">Encounter Diagnosis</span></p><p><b>code</b>: <span title=\"Codes:{http://snomed.info/sct 16932000}\">Nausea and Vomiting (disorder)</span></p><p><b>subject</b>: <a href=\"Patient-patient-betsysmith-johnson01.html\">Betsy Smith-Johnson</a></p><p><b>onset</b>: 2024-08-22 16:30:00-0400</p><p><b>recordedDate</b>: 2024-08-22 16:30:00-0400</p><p><b>note</b>: </p><blockquote><div><p>Patient pressed call button for vomiting. She reports she started feeling nauseated about ten minutes ago.</p>\n</div></blockquote></div>"
  },
  "extension": [
    {
      "url": "http://hl7.org/fhir/StructureDefinition/condition-assertedDate",
      "valueDateTime": "2024-08-22T16:30:00-04:00"
    }
  ],
  "clinicalStatus": {
    "coding": [
      {
        "system": "http://terminology.hl7.org/CodeSystem/condition-clinical",
        "code": "active"
      }
    ]
  },
  "verificationStatus": {
    "coding": [
      {
        "system": "http://terminology.hl7.org/CodeSystem/condition-ver-status",
        "code": "confirmed"
      }
    ]
  },
  "category": [
    {
      "coding": [
        {
          "system": "http://hl7.org/fhir/sid/icf",
          "code": "b5350",
          "display": "Sensation of nausea"
        }
      ]
    },
    {
      "coding": [
        {
          "system": "http://terminology.hl7.org/CodeSystem/condition-category",
          "code": "encounter-diagnosis",
          "display": "Encounter Diagnosis"
        }
      ]
    }
  ],
  "code": {
    "coding": [
      {
        "system": "http://snomed.info/sct",
        "code": "16932000",
        "display": "Nausea and vomiting"
      }
    ],
    "text": "Nausea and Vomiting (disorder)"
  },
  "subject": {
    "reference": "Patient/patient-betsysmith-johnson01",
    "display": "Betsy Smith-Johnson"
  },
  "onsetDateTime": "2024-08-22T16:30:00-04:00",
  "recordedDate": "2024-08-22T16:30:00-04:00",
  "note": [
    {
      "text": "Patient pressed call button for vomiting. She reports she started feeling nauseated about ten minutes ago."
    }
  ]
}