{
  "resourceType" : "Condition",
  "id" : "PFEIG-Condition-RightWeak",
  "meta" : {
    "profile" : ["http://hl7.org/fhir/us/pacio-pfe/StructureDefinition/pfe-condition-problems-health-concerns"]
  },
  "text" : {
    "status" : "generated",
    "div" : "<div xmlns=\"http://www.w3.org/1999/xhtml\"><p class=\"res-header-id\"><b>Generated Narrative: Condition PFEIG-Condition-RightWeak</b></p><a name=\"PFEIG-Condition-RightWeak\"> </a><a name=\"hcPFEIG-Condition-RightWeak\"> </a><a name=\"PFEIG-Condition-RightWeak-en-US\"> </a><p><b>clinicalStatus</b>: <span title=\"Codes:{http://terminology.hl7.org/CodeSystem/condition-clinical active}\">Active</span></p><p><b>verificationStatus</b>: <span title=\"Codes:{http://terminology.hl7.org/CodeSystem/condition-ver-status confirmed}\">Confirmed</span></p><p><b>category</b>: <span title=\"Codes:{http://hl7.org/fhir/us/core/CodeSystem/condition-category health-concern}\">Health Concern</span>, <span title=\"Codes:{http://hl7.org/fhir/us/core/CodeSystem/us-core-category functional-status}\">Functional Status</span></p><p><b>code</b>: <span title=\"Codes:{http://snomed.info/sct 570961000124101}\">Weakness of right upper limb (finding)</span></p><p><b>bodySite</b>: <span title=\"Codes:{http://snomed.info/sct 368209003}\">Right upper arm structure (body structure)</span></p><p><b>subject</b>: <a href=\"Patient-PFEIG-patientBSJ1.html\">Betsy Smith-Johnson Female, DoB Unknown ( http://example.org/identifiers/patient#10A3D58WH1600)</a></p><p><b>onset</b>: 2023-12-15 15:40:00-0500</p><p><b>recordedDate</b>: 2024-01-18 14:10:00-0500</p><p><b>asserter</b>: <a href=\"Practitioner-PFEIG-Practitioner-JenCadbury.html\">Practitioner Jen Cadbury</a></p><h3>Evidences</h3><table class=\"grid\"><tr><td style=\"display: none\">-</td><td><b>Detail</b></td></tr><tr><td style=\"display: none\">*</td><td><a href=\"Condition-PFEIG-Condition-HemiparesisDiagnosis.html\">Condition Right hemiparesis (disorder)</a></td></tr></table><p><b>note</b>: The weakness and lack of coordination in the patient's right shoulder, arm, and hand are secondary to the stroke. PT/OT from SNF report improvements to rotator cuff strength over last month.</p></div>"
  },
  "extension" : [{
    "url" : "http://hl7.org/fhir/StructureDefinition/condition-assertedDate",
    "valueDateTime" : "2023-12-16T13:30:00-05:00"
  }],
  "clinicalStatus" : {
    "coding" : [{
      "system" : "http://terminology.hl7.org/CodeSystem/condition-clinical",
      "code" : "active"
    }]
  },
  "verificationStatus" : {
    "coding" : [{
      "system" : "http://terminology.hl7.org/CodeSystem/condition-ver-status",
      "code" : "confirmed"
    }]
  },
  "category" : [{
    "coding" : [{
      "system" : "http://hl7.org/fhir/us/core/CodeSystem/condition-category",
      "code" : "health-concern",
      "display" : "Health Concern"
    }]
  },
  {
    "coding" : [{
      "system" : "http://hl7.org/fhir/us/core/CodeSystem/us-core-category",
      "code" : "functional-status",
      "display" : "Functional Status"
    }]
  }],
  "code" : {
    "coding" : [{
      "system" : "http://snomed.info/sct",
      "code" : "570961000124101",
      "display" : "Weakness of right upper limb (finding)"
    }]
  },
  "bodySite" : [{
    "coding" : [{
      "system" : "http://snomed.info/sct",
      "code" : "368209003",
      "display" : "Right upper arm structure (body structure)"
    }]
  }],
  "subject" : {
    "reference" : "Patient/PFEIG-patientBSJ1"
  },
  "onsetDateTime" : "2023-12-15T15:40:00-05:00",
  "recordedDate" : "2024-01-18T14:10:00-05:00",
  "asserter" : {
    "reference" : "Practitioner/PFEIG-Practitioner-JenCadbury"
  },
  "evidence" : [{
    "detail" : [{
      "reference" : "Condition/PFEIG-Condition-HemiparesisDiagnosis"
    }]
  }],
  "note" : [{
    "text" : "The weakness and lack of coordination in the patient's right shoulder, arm, and hand are secondary to the stroke. PT/OT from SNF report improvements to rotator cuff strength over last month."
  }]
}