{
  "resourceType": "Condition",
  "id": "betsysmith-johnson01-Condition-OTProblemListDecondition-01",
  "meta": {
    "profile": [
      "http://hl7.org/fhir/us/pacio-pfe/StructureDefinition/pfe-condition-problems-health-concerns"
    ]
  },
  "text": {
    "status": "extensions",
    "div": "<div xmlns=\"http://www.w3.org/1999/xhtml\"><p class=\"res-header-id\"><b>Generated Narrative: Condition betsysmith-johnson01-Condition-OTProblemListDecondition-01</b></p><a name=\"betsysmith-johnson01-Condition-OTProblemListDecondition-01\"> </a><a name=\"hcbetsysmith-johnson01-Condition-OTProblemListDecondition-01\"> </a><div style=\"display: inline-block; background-color: #d9e0e7; padding: 6px; margin: 4px; border: 1px solid #8da1b4; border-radius: 5px; line-height: 60%\"><p style=\"margin-bottom: 0px\"/><p style=\"margin-bottom: 0px\">Profile: <a href=\"http://hl7.org/fhir/us/pacio-pfe/STU2/StructureDefinition-pfe-condition-problems-health-concerns.html\">Personal Functioning and Engagement Condition Problems and Health Concerns Profile</a></p></div><p><b>Condition Asserted Date</b>: 2024-09-03 15:40:00-0400</p><p><b>clinicalStatus</b>: <span title=\"Codes:{http://terminology.hl7.org/CodeSystem/condition-clinical active}\">Active</span></p><p><b>verificationStatus</b>: <span title=\"Codes:{http://terminology.hl7.org/CodeSystem/condition-ver-status confirmed}\">Confirmed</span></p><p><b>category</b>: <span title=\"Codes:{http://hl7.org/fhir/sid/icf b7303}\">Power of muscles in lower half of the body</span>, <span title=\"Codes:{http://terminology.hl7.org/CodeSystem/condition-category problem-list-item}\">Problem List Item</span>, <span title=\"Codes:{http://hl7.org/fhir/us/core/CodeSystem/us-core-category functional-status}\">Functional Status</span></p><p><b>code</b>: <span title=\"Codes:{http://snomed.info/sct 31031000119102}\">Physical deconditioning (finding)</span></p><p><b>bodySite</b>: <span title=\"Codes:{http://snomed.info/sct 362875007}\">Entire lower body</span></p><p><b>subject</b>: <a href=\"Patient-patient-betsysmith-johnson01.html\">Betsy Smith-Johnson</a></p><p><b>onset</b>: 2024-08-30 15:40:00-0400</p><p><b>recordedDate</b>: 2024-09-03 15:40:00-0400</p><p><b>asserter</b>: <a href=\"PractitionerRole-Role-OT-JenCadbury.html\">PractitionerRole Occupational Therapist</a></p><blockquote><p><b>evidence</b></p><p><b>detail</b>: <a href=\"Observation-betsysmith-johnson01-MDS-ShortWalk1.html\">Observation Walk 50 feet with two turns - functional goal during assessment period [CMS Assessment]</a></p></blockquote><blockquote><p><b>evidence</b></p><p><b>detail</b>: <a href=\"Observation-betsysmith-johnson01-MDS-SitStand1.html\">Observation Sit to stand - functional goal during assessment period [CMS Assessment]</a></p></blockquote><blockquote><p><b>evidence</b></p><p><b>detail</b>: <a href=\"Observation-betsysmith-johnson01-MDS-SitUp1.html\">Observation Lying to sitting on side of bed - functional goal during assessment period [CMS Assessment]</a></p></blockquote><p><b>note</b>: </p><blockquote><div><p>The weakness in the patient's lower extremities is secondary to deconditioning. According to the report from Neurology, patient did not have motor or sensory deficits below upper chest. High rehab potential.</p>\n</div></blockquote></div>"
  },
  "extension": [
    {
      "url": "http://hl7.org/fhir/StructureDefinition/condition-assertedDate",
      "valueDateTime": "2024-09-03T15:40:00-04:00"
    }
  ],
  "clinicalStatus": {
    "coding": [
      {
        "system": "http://terminology.hl7.org/CodeSystem/condition-clinical",
        "code": "active"
      }
    ]
  },
  "verificationStatus": {
    "coding": [
      {
        "system": "http://terminology.hl7.org/CodeSystem/condition-ver-status",
        "code": "confirmed"
      }
    ]
  },
  "category": [
    {
      "coding": [
        {
          "system": "http://hl7.org/fhir/sid/icf",
          "code": "b7303",
          "display": "Power of muscles in lower half of the body"
        }
      ]
    },
    {
      "coding": [
        {
          "system": "http://terminology.hl7.org/CodeSystem/condition-category",
          "code": "problem-list-item",
          "display": "Problem List Item"
        }
      ]
    },
    {
      "coding": [
        {
          "system": "http://hl7.org/fhir/us/core/CodeSystem/us-core-category",
          "code": "functional-status",
          "display": "Functional Status"
        }
      ]
    }
  ],
  "code": {
    "coding": [
      {
        "system": "http://snomed.info/sct",
        "code": "31031000119102",
        "display": "Physical deconditioning"
      }
    ],
    "text": "Physical deconditioning (finding)"
  },
  "bodySite": [
    {
      "coding": [
        {
          "system": "http://snomed.info/sct",
          "code": "362875007",
          "display": "Entire lower body"
        }
      ]
    }
  ],
  "subject": {
    "reference": "Patient/patient-betsysmith-johnson01",
    "display": "Betsy Smith-Johnson"
  },
  "onsetDateTime": "2024-08-30T15:40:00-04:00",
  "recordedDate": "2024-09-03T15:40:00-04:00",
  "asserter": {
    "reference": "PractitionerRole/Role-OT-JenCadbury"
  },
  "evidence": [
    {
      "detail": [
        {
          "reference": "Observation/betsysmith-johnson01-MDS-ShortWalk1"
        }
      ]
    },
    {
      "detail": [
        {
          "reference": "Observation/betsysmith-johnson01-MDS-SitStand1"
        }
      ]
    },
    {
      "detail": [
        {
          "reference": "Observation/betsysmith-johnson01-MDS-SitUp1"
        }
      ]
    }
  ],
  "note": [
    {
      "text": "The weakness in the patient's lower extremities is secondary to deconditioning. According to the report from Neurology, patient did not have motor or sensory deficits below upper chest. High rehab potential."
    }
  ]
}