{
  "resourceType": "Condition",
  "id": "wilmamarina01-Condition-Depression-01",
  "meta": {
    "profile": [
      "http://hl7.org/fhir/us/pacio-pfe/StructureDefinition/pfe-condition-encounter-diagnosis"
    ]
  },
  "text": {
    "status": "extensions",
    "div": "<div xmlns=\"http://www.w3.org/1999/xhtml\"><p class=\"res-header-id\"><b>Generated Narrative: Condition wilmamarina01-Condition-Depression-01</b></p><a name=\"wilmamarina01-Condition-Depression-01\"> </a><a name=\"hcwilmamarina01-Condition-Depression-01\"> </a><div style=\"display: inline-block; background-color: #d9e0e7; padding: 6px; margin: 4px; border: 1px solid #8da1b4; border-radius: 5px; line-height: 60%\"><p style=\"margin-bottom: 0px\"/><p style=\"margin-bottom: 0px\">Profile: <a href=\"http://hl7.org/fhir/us/pacio-pfe/STU2/StructureDefinition-pfe-condition-encounter-diagnosis.html\">Personal Functioning and Engagement Condition Encounter Diagnosis Profile</a></p></div><p><b>Condition Asserted Date</b>: 2005-02-12</p><p><b>clinicalStatus</b>: <span title=\"Codes:{http://terminology.hl7.org/CodeSystem/condition-clinical active}\">Active</span></p><p><b>verificationStatus</b>: <span title=\"Codes:{http://terminology.hl7.org/CodeSystem/condition-ver-status confirmed}\">Confirmed</span></p><p><b>category</b>: <span title=\"Codes:{http://terminology.hl7.org/CodeSystem/condition-category encounter-diagnosis}\">Encounter Diagnosis</span>, <span title=\"Codes:{http://hl7.org/fhir/sid/icf b152}\">Emotional functions</span></p><p><b>code</b>: <span title=\"Codes:{http://snomed.info/sct 35489007}\">Depressive disorder (disorder)</span></p><p><b>bodySite</b>: <span title=\"Codes:{http://snomed.info/sct 12738006}\">Brain structure</span></p><p><b>subject</b>: <a href=\"Patient-patient-wilmamarina01.html\">Wilma Marina</a></p><p><b>recordedDate</b>: 2005-02-12</p><p><b>asserter</b>: <a href=\"PractitionerRole-Role-Psych-GineseComeau.html\">PractitionerRole Psychiatrist (occupation)</a></p></div>"
  },
  "extension": [
    {
      "url": "http://hl7.org/fhir/StructureDefinition/condition-assertedDate",
      "valueDateTime": "2005-02-12"
    }
  ],
  "clinicalStatus": {
    "coding": [
      {
        "system": "http://terminology.hl7.org/CodeSystem/condition-clinical",
        "code": "active"
      }
    ]
  },
  "verificationStatus": {
    "coding": [
      {
        "system": "http://terminology.hl7.org/CodeSystem/condition-ver-status",
        "code": "confirmed"
      }
    ]
  },
  "category": [
    {
      "coding": [
        {
          "system": "http://terminology.hl7.org/CodeSystem/condition-category",
          "code": "encounter-diagnosis",
          "display": "Encounter Diagnosis"
        }
      ]
    },
    {
      "coding": [
        {
          "system": "http://hl7.org/fhir/sid/icf",
          "code": "b152",
          "display": "Emotional functions"
        }
      ]
    }
  ],
  "code": {
    "coding": [
      {
        "system": "http://snomed.info/sct",
        "code": "35489007",
        "display": "Depressive disorder"
      }
    ],
    "text": "Depressive disorder (disorder)"
  },
  "bodySite": [
    {
      "coding": [
        {
          "system": "http://snomed.info/sct",
          "code": "12738006",
          "display": "Brain structure"
        }
      ]
    }
  ],
  "subject": {
    "reference": "Patient/patient-wilmamarina01",
    "display": "Wilma Marina"
  },
  "recordedDate": "2005-02-12",
  "asserter": {
    "reference": "PractitionerRole/Role-Psych-GineseComeau"
  }
}