{
  "resourceType" : "Condition",
  "id" : "PFEIG-Condition-StrokeDiagnosis",
  "meta" : {
    "profile" : ["http://hl7.org/fhir/us/pacio-pfe/StructureDefinition/pfe-condition-encounter-diagnosis"]
  },
  "text" : {
    "status" : "generated",
    "div" : "<div xmlns=\"http://www.w3.org/1999/xhtml\"><p class=\"res-header-id\"><b>Generated Narrative: Condition PFEIG-Condition-StrokeDiagnosis</b></p><a name=\"PFEIG-Condition-StrokeDiagnosis\"> </a><a name=\"hcPFEIG-Condition-StrokeDiagnosis\"> </a><a name=\"PFEIG-Condition-StrokeDiagnosis-en-US\"> </a><p><b>clinicalStatus</b>: <span title=\"Codes:{http://terminology.hl7.org/CodeSystem/condition-clinical active}\">Active</span></p><p><b>verificationStatus</b>: <span title=\"Codes:{http://terminology.hl7.org/CodeSystem/condition-ver-status confirmed}\">Confirmed</span></p><p><b>category</b>: <span title=\"Codes:{http://terminology.hl7.org/CodeSystem/condition-category encounter-diagnosis}\">Encounter Diagnosis</span></p><p><b>code</b>: <span title=\"Codes:{http://snomed.info/sct 422504002}\">Ischemic Stroke (disorder)</span></p><p><b>bodySite</b>: <span title=\"Codes:{http://snomed.info/sct 414722000}\">Structure of middle cerebral artery M1 segment (body structure)</span>, <span title=\"Codes:{http://snomed.info/sct 7771000}\">Left</span></p><p><b>subject</b>: <a href=\"Patient-PFEIG-patientBSJ1.html\">Betsy Smith-Johnson Female, DoB Unknown ( http://example.org/identifiers/patient#10A3D58WH1600)</a></p><p><b>onset</b>: 2023-12-15 15:40:00-0500</p><p><b>recordedDate</b>: 2023-12-15 18:40:00-0500</p><p><b>note</b>: Partial occlusion of MCA. Stroke event witnessed. EMS response / patient arrived within 45 minutes of symptom onset. Verified by CT with contrast. tPA administered within 2 hours of symptom onset.</p></div>"
  },
  "extension" : [{
    "url" : "http://hl7.org/fhir/StructureDefinition/condition-assertedDate",
    "valueDateTime" : "2023-12-15T18:40:00-05:00"
  }],
  "clinicalStatus" : {
    "coding" : [{
      "system" : "http://terminology.hl7.org/CodeSystem/condition-clinical",
      "code" : "active"
    }]
  },
  "verificationStatus" : {
    "coding" : [{
      "system" : "http://terminology.hl7.org/CodeSystem/condition-ver-status",
      "code" : "confirmed"
    }]
  },
  "category" : [{
    "coding" : [{
      "system" : "http://terminology.hl7.org/CodeSystem/condition-category",
      "code" : "encounter-diagnosis",
      "display" : "Encounter Diagnosis"
    }]
  }],
  "code" : {
    "coding" : [{
      "system" : "http://snomed.info/sct",
      "code" : "422504002",
      "display" : "Ischemic Stroke (disorder)"
    }]
  },
  "bodySite" : [{
    "coding" : [{
      "system" : "http://snomed.info/sct",
      "code" : "414722000",
      "display" : "Structure of middle cerebral artery M1 segment (body structure)"
    }]
  },
  {
    "coding" : [{
      "system" : "http://snomed.info/sct",
      "code" : "7771000",
      "display" : "Left"
    }]
  }],
  "subject" : {
    "reference" : "Patient/PFEIG-patientBSJ1"
  },
  "onsetDateTime" : "2023-12-15T15:40:00-05:00",
  "recordedDate" : "2023-12-15T18:40:00-05:00",
  "note" : [{
    "text" : "Partial occlusion of MCA. Stroke event witnessed. EMS response / patient arrived within 45 minutes of symptom onset. Verified by CT with contrast. tPA administered within 2 hours of symptom onset."
  }]
}